{
  "$schema": "https://json-schema.org/draft/2020-12/schema",
  "$id": "https://research.local/s9/schemas/v5/island_executable.schema.json",
  "title": "Island executable (v5)",
  "$comment": "Self-contained runnable island binding model, graph, layer range, atomic weight sets, prepared images, backend route, correctness certificate, I/O bounds, state policy, and fallback. The v5 island_digest binds every schema-allowed content field.",
  "type": "object",
  "additionalProperties": false,
  "$defs": {
    "sha256": {
      "type": "string",
      "pattern": "^sha256:[0-9a-f]{64}$"
    }
  },
  "properties": {
    "schema_version": {
      "type": "integer",
      "const": 5
    },
    "kind": {
      "type": "string",
      "const": "island_executable"
    },
    "island_id": {
      "type": "string",
      "minLength": 1,
      "maxLength": 256
    },
    "service_class": {
      "type": "string",
      "enum": [
        "decode",
        "prefill",
        "embedding",
        "rerank",
        "vision_encode",
        "background"
      ]
    },
    "model_id": {
      "type": "string",
      "minLength": 1,
      "maxLength": 256
    },
    "model_version": {
      "$ref": "#/$defs/sha256"
    },
    "graph_hash": {
      "$ref": "#/$defs/sha256"
    },
    "backend": {
      "type": "string",
      "enum": [
        "htp",
        "gpu",
        "cpu"
      ]
    },
    "layer_range": {
      "type": "object",
      "additionalProperties": false,
      "properties": {
        "start": {
          "type": "integer",
          "minimum": 0,
          "maximum": 100000
        },
        "end": {
          "type": "integer",
          "minimum": 1,
          "maximum": 100000
        },
        "n_layer_total": {
          "type": "integer",
          "minimum": 1,
          "maximum": 100000
        }
      },
      "required": [
        "start",
        "end",
        "n_layer_total"
      ]
    },
    "required_weight_set_ids": {
      "type": "array",
      "minItems": 1,
      "maxItems": 256,
      "items": {
        "type": "string",
        "minLength": 1,
        "maxLength": 256
      },
      "uniqueItems": true
    },
    "required_weight_set_digests": {
      "type": "array",
      "minItems": 1,
      "maxItems": 256,
      "items": {
        "$ref": "#/$defs/sha256"
      },
      "uniqueItems": true
    },
    "required_prepared_image_ids": {
      "type": "array",
      "minItems": 1,
      "maxItems": 256,
      "items": {
        "type": "string",
        "minLength": 1,
        "maxLength": 256
      },
      "uniqueItems": true
    },
    "required_prepared_image_digests": {
      "type": "array",
      "minItems": 1,
      "maxItems": 256,
      "items": {
        "$ref": "#/$defs/sha256"
      },
      "uniqueItems": true
    },
    "io_schema": {
      "type": "object",
      "additionalProperties": false,
      "properties": {
        "input_dtype": {
          "type": "string",
          "enum": [
            "f16",
            "f32",
            "bf16"
          ]
        },
        "output_dtype": {
          "type": "string",
          "enum": [
            "f16",
            "f32",
            "bf16"
          ]
        },
        "max_input_bytes": {
          "type": "integer",
          "minimum": 1,
          "maximum": 9007199254740991
        },
        "max_output_bytes": {
          "type": "integer",
          "minimum": 1,
          "maximum": 9007199254740991
        }
      },
      "required": [
        "input_dtype",
        "output_dtype",
        "max_input_bytes",
        "max_output_bytes"
      ]
    },
    "state_policy": {
      "type": "string",
      "enum": [
        "stateless",
        "sticky",
        "rebuildable"
      ]
    },
    "correctness_id": {
      "type": "string",
      "minLength": 1,
      "maxLength": 256
    },
    "correctness_digest": {
      "$ref": "#/$defs/sha256"
    },
    "required_kernel_path": {
      "type": "string",
      "minLength": 1,
      "maxLength": 512
    },
    "fallback": {
      "type": "object",
      "additionalProperties": false,
      "properties": {
        "kind": {
          "type": "string",
          "const": "server"
        },
        "available": {
          "type": "boolean"
        }
      },
      "required": [
        "kind",
        "available"
      ]
    },
    "island_digest": {
      "$ref": "#/$defs/sha256"
    }
  },
  "required": [
    "schema_version",
    "kind",
    "island_id",
    "service_class",
    "model_id",
    "model_version",
    "graph_hash",
    "backend",
    "layer_range",
    "required_weight_set_ids",
    "required_weight_set_digests",
    "required_prepared_image_ids",
    "required_prepared_image_digests",
    "io_schema",
    "state_policy",
    "correctness_id",
    "correctness_digest",
    "required_kernel_path",
    "fallback",
    "island_digest"
  ]
}
