{"backend":"htp","correctness_digest":"sha256:55eba22c2a33195b6b6283002581c624b41c02356a3d734b4ee18ea54e65a9b2","correctness_id":"cc1","fallback":{"available":true,"kind":"server"},"graph_hash":"sha256:b3c3cb5513880375f4d96a51ee23629e027baa8a3b3ed7551f34acbe5309d620","io_schema":{"input_dtype":"f16","max_input_bytes":983040,"max_output_bytes":983040,"output_dtype":"f16"},"island_digest":"sha256:dae88b75e0bb40ef90a3be3ebe280090678b57b77c0fb971272469f032d3145d","island_id":"isl1","kind":"island_executable","layer_range":{"end":1,"n_layer_total":2,"start":0},"model_id":"gemma4-12b-f16","model_version":"sha256:a2116482dd84e547aed9e9b02621f38361e02ecaa0b55269e4d2e4e8a79558b5","required_kernel_path":"hmx.decode.fa_off","required_prepared_image_digests":["sha256:e440d48acb47a836ee46ec6d8152b93798dca7fe201d7d07e226cacef8b0bab0"],"required_prepared_image_ids":["pi1"],"required_weight_set_digests":["sha256:3fa601b781e2ade54ab442125e635520389c4289329ba9ec2fd819e8e165ebc2"],"required_weight_set_ids":["ws1"],"schema_version":5,"service_class":"decode","state_policy":"sticky"}
